<?xml version="1.0" encoding="EUC-KR"?>
<!DOCTYPE EXCHANGE SYSTEM "exchange_mis.dtd">
<EXCHANGE>
	<HEADER>
		<COMMON>
			<SENDER>
				<SERVERID>DOC999999901</SERVERID>
				<USERID>admin</USERID>
				<EMAIL/>
			</SENDER>
			<RECEIVER>
				<SERVERID>DOC123456701</SERVERID>
				<USERID>admin</USERID>
			</RECEIVER>
			<TITLE>TEST TITLE_DOC</TITLE>
			<CREATED_DATE>2020-12-08 14:00:00</CREATED_DATE>
			<ATTACHNUM>1</ATTACHNUM>
			<ADMINISTRATIVE_NUM>TEST1234567890</ADMINISTRATIVE_NUM>
		</COMMON>
		<DIRECTION>
			<TO_DOCUMENT_SYSTEM notification="all">
				<MODIFICATION_FLAG>
					<MODIFIABLE modifyflag="yes"/>
				</MODIFICATION_FLAG>
			</TO_DOCUMENT_SYSTEM>
		</DIRECTION>
	</HEADER>
	<BODY><![CDATA[연계테스트 문서입니다.]]></BODY>
	<ATTACHMENTS>
		<ATTACHMENT filename="attach_attach_title.txt">TEST_ATTACH.txt</ATTACHMENT>
	</ATTACHMENTS>
</EXCHANGE>
